"doi","id","subject","title","authors","year","publisher","resulttype","language","journal","url","paper_abstract","project_id","accessright","x","y","area_uri","cluster_labels","area","citation_count","cited_by_tweeters_count","readers.mendeley","readers","file_hash"
"10.1016/j.compedu.2013.06.013","dedup_wf_001::73ea889e731de4a80b38c5a742497130","Education","The development approach of a pedagogically-driven serious game to support Relationship and Sex Education (RSE) within a classroom setting","Arnab, Sylvester","2013-01-01","PERGAMON-ELSEVIER SCIENCE LTD","publication","","COMPUTERS & EDUCATION","","","258169","Open Access","0.5273","-0.4302","1","Assessing flow, Educational video, Learning standards","Assessing flow, Educational video, Learning standards","33","10","188","",""
"10.1016/j.compedu.2013.07.023","dedup_wf_001::ceea47bdf566568b877d459cdd60f472","education comparing;attitudes playing;comparing scotland","Students’ attitudes toward playing games and using games in education: Comparing Scotland and the Netherlands","Hainey, Thomas","2013-09-05","PERGAMON-ELSEVIER SCIENCE LTD","publication","","COMPUTERS & EDUCATION","","Hainey, T., Westera, W., Connolly, T. M., Boyle, L., Baxter, G., Beeby, R. B., & Soﬂano, M. (2013). Students’ attitudes toward playing games and using games in education: Comparing Scotland and the Netherlands. Computers & Education, 69, 474-484. http://dx.doi.org/10.1016/j.compedu.2013.07.023","258169","Open Access","0.3336","-0.4894","7","Commercial outcomes, Comparing scotland, Computer games","Commercial outcomes, Comparing scotland, Computer games","20",NA,NA,"",""
"10.1016/j.csi.2013.06.002","webcrawl____::2ea8773a0b07a08487c8bafe89143ffd","educational video; learning;learning standards","Using e-learning standards in educational video games","del Blanco, Angel","2013-01-01","ELSEVIER SCIENCE BV","publication","","COMPUTER STANDARDS & INTERFACES","","","258169","Closed Access","0.3436","-0.6208","1","Assessing flow, Educational video, Learning standards","Assessing flow, Educational video, Learning standards","18","2","44","",""
"10.1016/j.culher.2013.04.004","dedup_wf_001::bccfc2fd5de073e79fdcde71fd97494d","[INFO.INFO-GR] Computer Science [cs]/Graphics [cs.GR]","Learning cultural heritage by serious games","Mortara, Michela","2014-05-01","Elsevier","publication","","Journal of Cultural Heritage","https://hal.archives-ouvertes.fr/hal-01120560/document","International audience; Immersive technologies such as virtual environments and augmented reality have a clear potential to support the experiencing of cultural heritage by the large public, complementing the current tools and practices based on tangible goods such as museums, exhibitions, books and visual content. Serious games - videogames designed for educational objectives - appear as a new tool to learn cultural content in an engaging way. In this paper, we will provide an extensive portrait of the current proposition of serious games in the cultural sector, highlighting the educational objectives of games in this domain and analysing the complex relations between genre, context of use, technological solutions and learning effectiveness. We finally identify and discuss the most significant challenges in the design and adoption of educational games in cultural heritage.","258169","Open Access","0.207","-0.0929","7","Commercial outcomes, Comparing scotland, Computer games","Commercial outcomes, Comparing scotland, Computer games","61","1","234","",""
"10.1016/j.ijhcs.2012.03.004","webcrawl____::f9bf0540cc2a60ceadaed1b53b2e7b59","assess presence; auditory;auditory event","Using auditory event-related EEG potentials to assess presence in virtual reality","Kober, Silvia Erika","2012-01-01","ACADEMIC PRESS LTD- ELSEVIER SCIENCE LTD","publication","","INTERNATIONAL JOURNAL OF HUMAN-COMPUTER STUDIES","","","258169","Closed Access","-0.7416","-0.0134","2","Virtual reality, Assess presence, Auditory event","Virtual reality, Assess presence, Auditory event","13","2","95","",""
"10.1016/j.ijpsycho.2011.12.003","webcrawl____::7413fd4968d3cbfcdaef23a3cf078576","correlate spatial;cortical correlate;d d","Cortical correlate of spatial presence in 2D and 3D interactive virtual reality: An EEG study","Kober, Silvia Erika","2012-01-01","ELSEVIER SCIENCE BV","publication","","INTERNATIONAL JOURNAL OF PSYCHOPHYSIOLOGY","","","258169","Closed Access","-0.7247","0.0526","2","Virtual reality, Assess presence, Auditory event","Virtual reality, Assess presence, Auditory event","32","1","140","",""
"10.1016/j.ijpsycho.2012.01.014","dedup_wf_001::271d7e64b3c6ab6eb66d14fa6e4e9ffa","classification performance;computer interfaces;distinct mental","The effect of distinct mental strategies on classification performance for brain-computer interfaces","Friedrich, Elisabeth V. C.","2012-01-01","ELSEVIER SCIENCE BV","publication","","INTERNATIONAL JOURNAL OF PSYCHOPHYSIOLOGY","","","258169","Closed Access","-0.4985","0.5191","3","Brain computer interface, Based brain, Classification performance","Brain computer interface, Based brain, Classification performance","53",NA,NA,"",""
"10.1080/10447318.2012.668131","webcrawl____::347f45df4b9446aee4243c870aff26c9","depend presence;personality presence;presence measure","Personality and Presence in Virtual Reality: Does Their Relationship Depend on the Used Presence Measure?","Kober, Silvia Erika","2013-01-01","TAYLOR & FRANCIS INC","publication","","INTERNATIONAL JOURNAL OF HUMAN-COMPUTER INTERACTION","","","258169","Closed Access","-0.7642","-0.1076","2","Virtual reality, Assess presence, Auditory event","Virtual reality, Assess presence, Auditory event","13",NA,NA,"",""
"10.1109/icalt.2012.226","od______2367::d8346dbc1aa42561003e6a8891ce2fe8","game based learning, collaboration, TEL, game making","MAGICAL: Collaborative game building as a means to foster reasoning abilities and creativity","Bottino, Rosa Maria","2012-01-01","IEEE Computer Society","publication","","","","This proposal describes the aims and the expected outcomes of the MAGICAL (MAking Games In CollaborAtion for Learning) project that was funded in 2011 under the LLP transversal ICT Programme. MAGICAL is proposed here as an example of how digital games can fruitfully be employed to support students' intellectual development, which actually represents one of the main objectives of contemporary education. As a matter of fact, MAGICAL ultimate aim is that of triggering and enhancing students' key/transversal skills among which reasoning abilities, creative attitudes and digital competence. The project investigates game creation as an innovative educational framework and addresses the development of the above mentioned abilities/attitudes by adopting a collaborative, \"learning by doing\" approach to digital game construction (game building in groups), which is actually quite new in the field. The outcomes of the project, which is still on-going, will hopefully trace new avenues for engaging students in both highly motivating and effective game- based educational activities. In a wider perspective, the working methodology adopted in this project could also be fruitfully re-used to inform further different educational initiatives.","258169","Restricted","0.2658","-0.3149","7","Commercial outcomes, Comparing scotland, Computer games","Commercial outcomes, Comparing scotland, Computer games","0",NA,NA,"",""
"10.1109/rita.2015.2391351","od_______126::85bcbc3dc89ea364123cd73a8d354690","Inteligencia artificial","15th International Symposium on Information and Communication Technologies in Education (SINTICE)","Torrente Vigil, Francisco Javier","2015-02-01","","publication","","","http://eprints.ucm.es/35971/1/15th%20International%20Symposium.pdf","It is our great pleasure to serve as guest editors for this special issue of the IEEE RITA journal, which holds a fine selection of the most relevant papers presented at SINTICE 2013, the fifteenth international symposium in educational technology held in Madrid in September 2013. The two papers included in this special issue are representative of the high quality observed during all the conference.","258169","Open Access","0.5951","0.4272","6","Inteligencia artificial","Inteligencia artificial","0",NA,NA,"",""
"10.1109/tciaig.2013.2260340","webcrawl____::3a80a8e2b567f99e3479281a058fba76","analysis assessing;assessing flow;electroencephalogram physiological","Electroencephalogram and Physiological Signal Analysis for Assessing Flow in Games","Berta, Riccardo","2013-01-01","IEEE-INST ELECTRICAL ELECTRONICS ENGINEERS INC","publication","","IEEE TRANSACTIONS ON COMPUTATIONAL INTELLIGENCE AND AI IN GAMES","","","258169","Closed Access","-0.5627","-0.3148","1","Assessing flow, Educational video, Learning standards","Assessing flow, Educational video, Learning standards","23","4","86","",""
"10.1109/tlt.2013.35","od_______126::7ff27c15a5f466771d9155d25b7c527c","Inteligencia artificial","Development of Game-Like Simulations for Procedural Knowledge in Healthcare Education","Torrente Vigil, Francisco Javier","2014-01-01","Institute of Electrical and Electronics Engineers Inc","publication","","","http://eprints.ucm.es/36125/1/e-UCM_draft_244.pdf","We present EGDA, an educational game development approach focused on the teaching of procedural knowledge using a cost-effective approach. EGDA proposes four tasks: analysis, design, implementation, and quality assurance that are subdivided in a total of 12 subtasks. One of the benefits of EGDA is that anyone can apply it to develop a game since it keeps development as simple as possible and uses tools for modeling and implementation that do not require a highly technical profile. EGDA has been applied to the creation of seven educational games in healthcare, and has been iteratively refined after each experience. EGDA is evaluated on two aspects. First, the effort and cost needed for creating these games is estimated and compared to current industry standards. Second, impact on knowledge acquisition and a student acceptance are discussed. Results suggest that EGDA can make game development more affordable, which is critical for increased adoption and scalability of game-based learning (GBL), while assuring a high educational value of the resulting games.","258169","Open Access","0.4158","-0.1906","7","Commercial outcomes, Comparing scotland, Computer games","Commercial outcomes, Comparing scotland, Computer games","11","3","73","",""
"10.1111/bjet.12113","core_ac_uk__::bd6316aefea60188a4b06ab203f6aee5","sgs;game mechanics","Mapping learning and game mechanics for serious games analysis","Arnab, Sylvester","2014-01-01","","publication","","","http://radar.gsa.ac.uk/3824/1/Arnab%20et%20al.%20BJET%20Final.pdf","This paper presents findings emerging from the EU-Funded Games and Learning Alliance (GALA)\ud Network of Excellence on serious games (SGs) that has a focus upon pedagogy-driven design of SGs.\ud The overall framework presented in this paper concerns some elements that we consider key for the\ud design of a new generation of more pedagogically-effective and easily author-able SGs: pedagogical perspectives, learning goals mapping to game mechanics and cognition-based SGs models. The paper also includes two corresponding illustrative case studies, developed by the network, on (1) the analysis of the Re-mission game based on the developed analytical framework of learning and game mechanics and (2) the Sandbox SGs cognition-based model in the Travel in Europe project.","258169","Open Access","0.0523","-0.1628","9","Cognitive control, Game mechanics","Cognitive control, Game mechanics","89","13","3","",""
"10.1155/2012/213143","dedup_wf_001::87d4e1afb5e6b9fec97775d1a1607002","Electronic computers. Computer science","A Game-Based Virtualized Reality Approach for Simultaneous Rehabilitation of Motor Skill and Confidence","Thin, Alasdair G.","2012-01-01","Hindawi Publishing Corporation","publication","","Advances in Human-Computer Interaction","/2012/HINDAWI.AHCI/213143-2012-11-26.xml","Virtualized reality games offer highly interactive and engaging user experience and therefore game-based approaches (GBVR) may have significant potential to enhance clinical rehabilitation practice as traditional therapeutic exercises are often repetitive and boring, reducing patient compliance. The aim of this study was to investigate if a rehabilitation training programme using GBVR could simultaneously improve both motor skill (MS) and confidence (CON), as they are both important determinants of daily living and physical and social functioning. The study was performed using a nondominant hand motor deficit model in nonambidextrous healthy young adults, whereby dominant and nondominant arms acted as control and intervention conditions, respectively. GBVR training was performed using a commercially available tennis-based game. CON and MS were assessed by having each subject perform a comparable real-world motor task (RWMT) before and after training. Baseline CON and MS for performing the RWMT were significantly lower for the nondominant hand and improved after GBVR training, whereas there were no changes in the dominant (control) arm. These results demonstrate that by using a GBVR approach to address a MS deficit in a real-world task, improvements in both MS and CON can be facilitated and such approaches may help increase patient compliance.","258169","Open Access","-0.3725","0.2645","5","Approach for simultaneous, Based virtualized reality, Game based virtualized","Approach for simultaneous, Based virtualized reality, Game based virtualized","1","3","14","",""
"10.1155/2012/369637","dedup_wf_001::8fb1f7e8449deb818a1479f479706b41","Electronic computers. Computer science","Usability Testing for Serious Games: Making Informed Design Decisions with User Data","Moreno-Ger, Pablo","2012-01-01","Hindawi Publishing Corporation","publication","","Advances in Human-Computer Interaction","/2012/HINDAWI.AHCI/369637-2012-11-20.xml","Usability testing is a key step in the successful design of new technologies and tools, ensuring that heterogeneous populations will be able to interact easily with innovative applications. While usability testing methods of productivity tools (e.g., text editors, spreadsheets, or management tools) are varied, widely available, and valuable, analyzing the usability of games, especially educational “serious” games, presents unique usability challenges. Because games are fundamentally different than general productivity tools, “traditional” usability instruments valid for productivity applications may fall short when used for serious games. In this work we present a methodology especially designed to facilitate usability testing for serious games, taking into account the specific needs of such applications and resulting in a systematically produced list of suggested improvements from large amounts of recorded gameplay data. This methodology was applied to a case study for a medical educational game, MasterMed, intended to improve patients’ medication knowledge. We present the results from this methodology applied to MasterMed and a summary of the central lessons learned that are likely useful for researchers who aim to tune and improve their own serious games before releasing them for the general public.","258169","Open Access","0.0366","-0.4749","7","Commercial outcomes, Comparing scotland, Computer games","Commercial outcomes, Comparing scotland, Computer games","20","4","98","",""
"10.1155/2013/136864","dedup_wf_001::7ad855ac56bd235cc9727df308fb1474","ComputingMilieux_PERSONALCOMPUTING","Assessment in and of Serious Games: An Overview","Bellotti, Francesco","2013-01-01","Hindawi Publishing Corporation","publication","","Advances in Human-Computer Interaction","/2013/HINDAWI.AHCI/136864-2013-02-28.xml","There is a consensus that serious games have a significant potential as a tool for instruction. However, their effectiveness in terms of learning outcomes is still understudied mainly due to the complexity involved in assessing intangible measures.  A systematic approach—based on established principles and guidelines—is necessary to enhance the design of serious games, and many studies lack a rigorous assessment. An important aspect in the evaluation of serious games, like other educational tools, is user performance assessment. This is an important area of exploration because serious games are intended to evaluate the learning progress as well as the outcomes. This also emphasizes the importance of providing appropriate feedback to the player. Moreover, performance assessment enables adaptivity and personalization to meet individual needs in various aspects, such as learning styles, information provision rates, feedback, and so forth. This paper first reviews related literature regarding the educational effectiveness of serious games. It then discusses how to assess the learning impact of serious games and methods for competence and skill assessment. Finally, it suggests two major directions for future research: characterization of the player’s activity and better integration of assessment in games.","258169","Open Access","-0.1222","-0.1612","7","Commercial outcomes, Comparing scotland, Computer games","Commercial outcomes, Comparing scotland, Computer games","74","7","52","",""
"10.1186/1743-0003-10-17","dedup_wf_001::8d9dcbb40f757d3518eb78e337bd0adf","Way-finding training","Virtual reality in neurologic rehabilitation of spatial disorientation","Kober Silvia","2013-02-01","BioMed Central","publication","","Journal of NeuroEngineering and Rehabilitation","","<p>Abstract</p> <p>Background</p> <p>Topographical disorientation (TD) is a severe and persistent impairment of spatial orientation and navigation in familiar as well as new environments and a common consequence of brain damage. Virtual reality (VR) provides a new tool for the assessment and rehabilitation of TD. In VR training programs different degrees of active motor control over navigation may be implemented (i.e. more passive spatial navigation vs. more active). Increasing demands of active motor control may overload those visuo-spatial resources necessary for learning spatial orientation and navigation. In the present study we used a VR-based verbally-guided passive navigation training program to improve general spatial abilities in neurologic patients with spatial disorientation.</p> <p>Methods</p> <p>Eleven neurologic patients with focal brain lesions, which showed deficits in spatial orientation, as well as 11 neurologic healthy controls performed a route finding training in a virtual environment. Participants learned and recalled different routes for navigation in a virtual city over five training sessions. Before and after VR training, general spatial abilities were assessed with standardized neuropsychological tests.</p> <p>Results</p> <p>Route finding ability in the VR task increased over the five training sessions. Moreover, both groups improved different aspects of spatial abilities after VR training in comparison to the spatial performance before VR training.</p> <p>Conclusions</p> <p>Verbally-guided passive navigation training in VR enhances general spatial cognition in neurologic patients with spatial disorientation as well as in healthy controls and can therefore be useful in the rehabilitation of spatial deficits associated with TD.</p> ","258169","Open Access","-0.0456","0.668","5","Approach for simultaneous, Based virtualized reality, Game based virtualized","Approach for simultaneous, Based virtualized reality, Game based virtualized","18","3","96","",""
"10.1255/jnirs1048","webcrawl____::b5f18f3b761c5869b29af5d86a460e4e","mental arithmetic;based real;classification infrared","A haemodynamic brain-computer interface based on real-time classification of near infrared spectroscopy signals during motor imagery and mental arithmetic","Stangl, Matthias","2013-01-01","N I R PUBLICATIONS","publication","","JOURNAL OF NEAR INFRARED SPECTROSCOPY","","","258169","Closed Access","-0.4261","0.5909","3","Brain computer interface, Based brain, Classification performance","Brain computer interface, Based brain, Classification performance","",NA,NA,"",""
"10.1371/journal.pone.0076214","dedup_wf_001::d12c41b612b730f6cf000baad76bf204","bci;protocol;sessions","Whatever works: a systematic user-centered training protocol to optimize brain-computer interfacing individually.","Elisabeth V C Friedrich","","Public Library of Science (PLoS)","publication","","PLoS ONE","","This study implemented a systematic user-centered training protocol for a 4-class brain-computer interface (BCI). The goal was to optimize the BCI individually in order to achieve high performance within few sessions for all users. Eight able-bodied volunteers, who were initially na?ve to the use of a BCI, participated in 10 sessions over a period of about 5 weeks. In an initial screening session, users were asked to perform the following seven mental tasks while multi-channel EEG was recorded: mental rotation, word association, auditory imagery, mental subtraction, spatial navigation, motor imagery of the left hand and motor imagery of both feet. Out of these seven mental tasks, the best 4-class combination as well as most reactive frequency band (between 8-30 Hz) was selected individually for online control. Classification was based on common spatial patterns and Fisher?s linear discriminant analysis. The number and time of classifier updates varied individually. Selection speed was increased by reducing trial length. To minimize differences in brain activity between sessions with and without feedback, sham feedback was provided in the screening and calibration runs in which usually no real-time feedback is shown. Selected task combinations and frequency ranges differed between users. The tasks that were included in the 4-class combination most often were (1) motor imagery of the left hand (2), one brain-teaser task (word association or mental subtraction) (3), mental rotation task and (4) one more dynamic imagery task (auditory imagery, spatial navigation, imagery of the feet). Participants achieved mean performances over sessions of 44-84% and peak performances in single-sessions of 58-93% in this user-centered 4-class BCI protocol. This protocol is highly adjustable to individual users and thus could increase the percentage of users who can gain and maintain BCI control. A high priority for future work is to examine this protocol with severely disabled users.","258169","Open Access","-0.1856","0.687","3","Brain computer interface, Based brain, Classification performance","Brain computer interface, Based brain, Classification performance","35",NA,NA,"",""
"10.1371/journal.pone.0134816","dedup_wf_001::99cf5b69ab847f39677d3a5ddcb43bbb","cognitive control;task","Neuronal Correlates of Cognitive Control during Gaming Revealed by Near-Infrared Spectroscopy","Witte, Matthias","2015-08-01","Public Library of Science","publication","","PLoS ONE","","In everyday life we quickly build and maintain associations between stimuli and behavioral responses. This is governed by rules of varying complexity and past studies have identified an underlying fronto-parietal network involved in cognitive control processes. However, there is only limited knowledge about the neuronal activations during more natural settings like game playing. We thus assessed whether near-infrared spectroscopy recordings can reflect different demands on cognitive control during a simple game playing task. Sixteen healthy participants had to catch falling objects by pressing computer keys. These objects either fell randomly (RANDOM task), according to a known stimulus-response mapping applied by players (APPLY task) or according to a stimulus-response mapping that had to be learned (LEARN task). We found an increased change of oxygenated and deoxygenated hemoglobin during LEARN covering broad areas over right frontal, central and parietal cortex. Opposed to this, hemoglobin changes were less pronounced for RANDOM and APPLY. Along with the findings that fewer objects were caught during LEARN but stimulus-response mappings were successfully identified, we attribute the higher activations to an increased cognitive load when extracting an unknown mapping. This study therefore demonstrates a neuronal marker of cognitive control during gaming revealed by near-infrared spectroscopy recordings.","258169","Open Access","-0.3692","7e-04","9","Cognitive control, Game mechanics","Cognitive control, Game mechanics","3","15","22","",""
