"doi","id","subject","title","authors","year","publisher","resulttype","language","journal","url","paper_abstract","project_id","accessright","x","y","area_uri","cluster_labels","area","citation_count","cited_by_tweeters_count","readers.mendeley","readers","file_hash"
"","od______2367::2faa9bdf32e506c234d514a3be5f04bb","Technolgy Enhanced Learning","Towards Creative Pedagogy: Empowering Students to Develop Games","Kiili, Kristian","2012-01-01","Academic Conferences","publication","","","","Due to social, economic, and technological changes in our society creativity is nowadays seen as basic survival and success factor. Thus, innovation, creativity and production of media should be emphasized also in the school of the future. However, current schooling system tends to produce consumers of media instead of creative problem solvers, critical thinkers, and producers of media. At this point also educators and policy makers should be creative and introduce innovative learning solutions and practices that support the development of creativity and 21 century skills. This paper replies to this call by considering learning by developing games as one of future learning strategies. Learning by developing games is not totally new idea, but the research has only begun to explore the possibilities that this pedagogical strategy provides. In this article we introduce a new game authoring environment MAGOS that is developed according to the framework of creative pedagogy. The framework of creative pedagogy comprises of three interrelated elements of creative teaching, teaching for creativity, and creative learning. From these three elements we derived eight design principles that guided the development of MAGOS environment. MAGOS supports creative teaching practices by providing different tools for planning and for teacher participation. Teaching for creativity is supported by offering an imaginative and innovative learning environment and tools with which a teacher can support students' creative and constructive processes. MAGOS include multiple elements that promote students' collaborative game development that is supposed to enhance co-creation of knowledge. MAGOS requires a joint effort for game development and enables building on each others' ideas through sharing and remixing other students' existing work. MAGOS also provides a tool that helps students to generate novel ideas for their joint game development.","258169","Restricted","0.4165","0.0322","9","Cognitive control, Game mechanics","Cognitive control, Game mechanics",NA,NA,NA,"",""
"","od______2367::389f3701ea547153fa4a11d940c743be","Serious Games, Games Based Learning, gioco, technology enhanced learning","The use of Serious Games and the teachers' role. Reflections on experience of the use of Serious Games in Italy, Spain and Romania","Ott, Michela","2012-01-01","Universitat de Barcelona 2011","publication","","","","This paper puts forward some experience-based reflections on the role of teachers in planning and conducting educational actions involving the use of Serious Games (SGs). We consider the previous studies in the evolution of the teacher role with the introduction of ICTs in the teaching and learning process and the use of Electronic Learning Objects (Adell & Sales, 2000; Bates, 2011). We focus our paper in the specific changes on the role of the teacher in the use of Serious Games in formal educational settings.","258169","Open Access","0.0342","-0.2923","9","Cognitive control, Game mechanics","Cognitive control, Game mechanics",NA,NA,NA,"",""
"","od______2367::3acd6aa78526b6e3ef9d29eb76c17482","ComputingMilieux_PERSONALCOMPUTING","Learning through playing for or against each other? Promoting collaborative learning in digital game based learning","Romero, Margarida","2012-01-01","Escuela Superior de Administraci?n y Direcci?n de Empresas","publication","","","","The process of learning through Game Based Learning (GBL) presents both positive aspects and challenges to be faced in order to support the achievement of learning goals and knowledge creation. This study aims to characterise game dynamics in the adoption of multi-player GBL. In particular, we examine the multi-player GBL dynamics may enhance collaborative learning through a relation of positive interdependence while at the same time maintaining a certain level of competition for ensuring multi-player GBL gameplay. The first section of the paper introduces collaborative GBL and describes the combination of intragroup dynamics of cooperation and positive interdependence and an intergroup dynamic of competition to maintain gameplay. The second part of the paper describes two multi-player GBL scenarios: the multi-player game with interpersonal competition and the multiplayer game with intergroup competition. For each scenario a case analysis of existing collaborative games is provided, which may help instructional and game designers when defining the collaborative GBL dynamics. Technological requirements and best practices in the use of collaborative GBL are described in the last sections.","258169","Open Access","-0.1444","-0.3631","9","Cognitive control, Game mechanics","Cognitive control, Game mechanics",NA,NA,NA,"",""
"","narcis______::cfd5c034d146da8aac05b09e0ba55f94","software;reusability;ecosystems","Strategies and Tools to Enable Reuse in Serious Games Ecosystems and Beyond","Stefan, I.A.","2014-04-24","","publication","","","https://ris.utwente.nl/ws/files/5348376/else_2014_I%20Stanescu_final.pdf","Software ecosystems are defined as collections of organizations that are related through software or a software related concept. Within such ecosystems, reusability is fundamental to software sustainability and cost-efficiency. Design for reusability brings the technical promise of high quality software that emerges from clean design, fitness for a purpose and a low defect count. This ensures the software is extensible to cater for or modifiable for different pipelines, data and purposes. Functionally, it facilitates the transition from Serious Games (SG) software projects that have been known to consume endless resources, and deliver expensive products, to successful SG projects in terms of quality, costs and timeframe. From an educational perspective, efforts at national and international level aim to increase the accessibility of serious game development via reusable, open components repositories. To enable SG researchers, developers, and implementers adopt reusability, it is necessary to create a gateway to reusable SG assets in the SG community. This would faciliate the SG community members to start exploring the large and rapidly growing body of literature on SG research, development and implementation, as well as on reuse for more detailed information on cost models, class libraries, organizational structures, repository management, knowledge reuse, and many other important issues. For SG reusability to reach its full potential this effort should not address exclusively the SG ecosystems but cross the boundaries of other disciplines and establishes the impact of reusable SG assets and knowledge has on related fields. Under these premises, the authors consider the development premises of a Serious Games Reusability Reference Point (SGREF) that aims to assist the SG community and also support transdisciplinary initiatives.","258169","Open Access","0.6486","0.0082","14","Awareness on shared, Supply chain management, Collaborative serious games","Awareness on shared, Supply chain management, Collaborative serious games",NA,NA,NA,"",""
"","od______2367::6ee546032dd1bcddf759d0dc0212b7f8","Serious Games, Games Based Learning, gioco, game design, technology enhanced learning","GaLA Fifth Quarterly Report - CNR","Earp, Jeffrey","2012-01-20","","publication","","","","Quarterly report on progress of CNR activities and outputs in the EC Network of Excellence (GaLA) - Year Two, First Quarter","258169","Restricted","-0.2981","-0.3096","15","Game design, Games based learning, Gioco","Game design, Games based learning, Gioco",NA,NA,NA,"",""
"","webcrawl____::3e90cdf7ed4461dd647789b880b23282","contribution empirical;empirical research;improve students","MareMonstrum: a Contribution to Empirical Research about How the Use of MUVEs May Improve Students' Motivation","Sancho, Pilar","2012-01-01","GRAZ UNIV TECHNOLGOY, INST INFORMATION SYSTEMS COMPUTER MEDIA-IICM","publication","","JOURNAL OF UNIVERSAL COMPUTER SCIENCE","","","258169","Closed Access","0.4225","0.6285","10","Contribution empirical, Empirical research, Improve students","Contribution empirical, Empirical research, Improve students",NA,NA,NA,"",""
"","od______2367::4bc891a60940c9b68018f92d713eed9e","Serious Games, Games Based Learning, gioco, game design, technology enhanced learning","GaLA Sixth Quarterly Report - CNR","Earp, Jeffrey","2012-05-30","","publication","","","","Quarterly report on progress of CNR activities and outputs in the EC Network of Excellence (GaLA) - Year Two Second Quarter","258169","Restricted","-0.3037","-0.3146","15","Game design, Games based learning, Gioco","Game design, Games based learning, Gioco",NA,NA,NA,"",""
"10.1007/978-3-319-05972-3_4","core_ac_uk__::4519ee607e475a69b1d574fc6d2ca885","ComputingMilieux_PERSONALCOMPUTING","Narrative Serious Game Mechanics (NSGM) – Insights into the Narrative-Pedagogical Mechanism","Lim, Theodore","2014-04-01","Springer","publication","","","http://radar.gsa.ac.uk/3888/2/GameDays2014%20v%20final%20AAM%203888.pdf","Narratives are used to construct and deconstruct the time and space of events. In games, as in real life, narratives add layers of meaning and engage players by enhancing or clarifying content. From an educational perspective, narratives are a semiotic conduit for evoking critical thinking skills and promoting knowledge discovery/acquisition. While narrative is central to Serious Games (SG), the relationships between gameplay, narrative and pedagogy in SG design remain unclear, and narrative’s elemental influence on learning outcomes is not fully understood yet. This paper presents a purpose-processing methodology that aims to support the mapping of SG design patterns and pedagogical practices, allowing designers to create more meaningful SGs. In the case of narrative, the intention is to establish whether Narrative Serious Game Mechanics (NSGM) can provide players with opportunities for reasoning and reflective analysis that may even transcend the game-based learning environment.","258169","Open Access","-0.0316","-0.6594","4","Educational game, Facilitate educational, Game authoring","Educational game, Facilitate educational, Game authoring","5",NA,NA,"",""
"10.1007/978-3-319-11623-5_15","dedup_wf_001::27a495b5bdfadecdf2bbc24c14fad7bb","commercial outcomes;companies","Measuring the commercial outcomes of serious games in companies: a review","Riedel, Johann Christian Karl Henry","2014-07-01","Springer","publication","","","http://eprints.nottingham.ac.uk/30686/1/SGDA%20Commercial%20Outcomes%20Paper%20OA%20version.pdf","The objective of this paper is to review the work on the measurement of the commercial outcomes of serious games in companies and to provide a framework for their measurement in companies. The literature on the evaluation of training and in particular serious games is presented. A systematic literature review of studies of the impacts of business games in companies was undertaken. The paper summarises the existing studies on measuring the effectiveness of serious games in companies. A search of the grey literature was also conducted to establish what kinds of commercial outcomes have been measured and how. Finally, the paper presents some examples of measuring the commercial outcomes. It also provides some advice on how to measure commercial outcomes.","258169","Open Access","-0.3249","-0.5894","7","Commercial outcomes, Comparing scotland, Computer games","Commercial outcomes, Comparing scotland, Computer games","3",NA,NA,"",""
"10.1007/978-3-319-12157-4_34","narcis______::e9781eddbb7760b792427b9c94a4a0f0","cad;creativity;mechanisms","Harmonizing interoperability - Emergent Serious Gaming in Playful Stochastic CAD Environments","Kosmadoudi, Z.","2014-10-23","Springer International Publishing","publication","","","","Computer-Aided Design (CAD) applications often promote memorable experiences for the wrong reasons. Coupled with complex functionality and poor user experience the learning curve is often steep and overwhelming. Invoking design creativity remains limited to conveying established geometry. Gameplay conversely excels in memorable and formative experiences and could spur intuition and natural creativity. If games are profoundly imbued for purposeful play, thriving on tacit and explicit user knowledge, a CAD system carefully stylized with ludic mechanisms could potentially be highly productive. An emergent serious game (SG) and CAD system may then hold promise. Preliminary feedbacks suggest a game-CAD environment incorporating interoperable mechanisms of CAD and SG systems to exchange creation improves user interactions resulting in better evolution of the workflow. The emerging scenarios presented reports a transformative approach to understanding of relationships in CAD use, learning and play mechanisms that enhance creativity and innovation.","258169","Closed Access","0.1019","0.2884","8","Cad, Creativity, [info.info-ia] computer science [cs]/computer aided engineering","Cad, Creativity, [info.info-ia] computer science [cs]/computer aided engineering","1",NA,NA,"",""
"10.1007/978-3-319-12157-4_34","dedup_wf_001::9dcd016d70da6c3a6aebc59f4b5abbbb","[INFO.INFO-IA] Computer Science [cs]/Computer Aided Engineering","Harmonizing Interoperability – Emergent Serious Gaming in Playful Stochastic CAD Environments","KOSMADOUDI, Zoe","2013-10-23","Springer","publication","","","https://hal.archives-ouvertes.fr/hal-01143468/document","International audience; Computer-Aided Design (CAD) applications often promote memorable experiences for the wrong reasons. Coupled with complex functionality and poor user experience the learning curve is often steep and overwhelming. Invoking design creativity remains limited to conveying established geometry. Gameplay conversely excels in memorable and formative experiences and could spur intuition and natural creativity. If games are profoundly imbued for purposeful play, thriving on tacit and explicit user knowledge, a CAD system carefully stylized with ludic mechanisms could potentially be highly productive. An emergent serious game (SG) and CAD system may then hold promise. Preliminary feedbacks suggest a game-CAD environment incorporating interoperable mechanisms of CAD and SG systems to exchange creation improves user interactions resulting in better evolution of the workflow. The emerging scenarios presented reports a transformative approach to understanding of relationships in CAD use, learning and play mechanisms that enhance creativity and innovation.","258169","Open Access","0.1072","0.2882","8","Cad, Creativity, [info.info-ia] computer science [cs]/computer aided engineering","Cad, Creativity, [info.info-ia] computer science [cs]/computer aided engineering","1",NA,NA,"",""
"10.1007/978-3-319-22960-7_10","narcis______::4e7e8b8c189d932237779ed9a7e632c7","ComputingMilieux_LEGALASPECTSOFCOMPUTING","The journey : a service-based adaptive serious game on probability","Brandao Carvalho, MB Maira","2014-01-01","Springer","publication","","","https://pure.tue.nl/ws/files/3842828/906105649656609.pdf","","258114","Open Access","-0.5009","-0.535","7","Commercial outcomes, Comparing scotland, Computer games","Commercial outcomes, Comparing scotland, Computer games","0",NA,NA,"",""
"10.1007/978-3-642-40352-1_78","dedup_wf_001::8e3767f19ca24fef9500070bee7def2e","[INFO] Computer Science [cs]","The Use of Serious Games in the Education of Engineers","Hauge, Jannicke,","2012-09-24","Springer","publication","","","https://hal.inria.fr/hal-01472300/document","Part 3: Human Factors, Learning and Innovation; International audience; Serious games have been used in the education of engineering students and professionals for decades, but still they have not reached their maximum diffusion. Learning by gaming is often seen as not serious enough within higher education and vocational training. Consequently, gaming as a teaching method is still often excluded from many curricula. Hence, students lack the experience of active knowledge acquisition during lessons and encounter a barrier for successful participation in serious games later. Although a variety of games have been developed and proved successful for the mediation of skills in complex systems (Windhoff, 2001), this paper discusses why we think that serious games should be considered as a suitable learning method for the mediation of skills needed in the education of engineers and secondly to give some examples of current games and experience of their use.","258169","Open Access","0.1885","-0.2502","7","Commercial outcomes, Comparing scotland, Computer games","Commercial outcomes, Comparing scotland, Computer games","2",NA,NA,"",""
"10.1007/978-3-662-44736-9_60","dedup_wf_001::81eb891599593c5d154dbfdebf34c4f1","[INFO] Computer Science [cs]","Collaborative Serious Games for Awareness on Shared Resources in Supply Chain Management","Baalsrud Hauge, Jannicke","2014-09-20","Springer","publication","","","https://hal.inria.fr/hal-01387923/document","Part 1: Knowledge-Based Sustainability; International audience; Today manufacturing is a complex process often resulting in long brittle supply chains with considerable contributions to the global resource demand also posing a negative environmental impact (CO2 emissions, raw material supply, etc.). Reducing the waste of resources and being more sustainable are objectives incentivized by materials in short supply and customer requirements. Thus, the ability to share resources, innovate and to implement emergent ICT will play a key role for companies’ competitiveness and their sustainability. However, sharing resources puts high requirements on trust and gain sharing, amongst others. Although well known in supply chain management, the logistics sector is struggling to increase their shared resources. The authors found serious games (SG) to be a promising tool for awareness rising on shared resource. Existing supply chain games are analysed and their potential and weaknesses for the topic are examined, resulting in an outlook on the research needs in SGs for awareness on shared resources.","314338","Open Access","0.4024","0.4116","14","Awareness on shared, Supply chain management, Collaborative serious games","Awareness on shared, Supply chain management, Collaborative serious games","1",NA,NA,"",""
"10.1007/s11423-013-9321-6","od_______126::cb0c6c3fbea996b95250ebeb03908d9b","Inteligencia artificial","Developing game-like simulations to formalize tacit procedural knowledge: the ONT experience","Borro Escribano, Blanca Beatriz","2014-04-01","Springer Boston","publication","","","http://eprints.ucm.es/36127/1/e-UCM_draft_241%20Developing%20game-like...the%20ONT.pdf","The exceptional success achieved by the Spanish National Transplant Organization (ONT) in recent years has made other countries highly interested in following this organization’s methodologies. A good training program is one of the key elements of the ONT. Until 2012, the ONT training program was a paper-based case teaching method, and the small number of ONT experts limited the audience. In an attempt to improve and increase the attendees in this program, a game-like simulation was developed to represent transplant management procedural knowledge. To maximize the educational value, this game-like simulation was based on representative teaching cases to help students practice with different real situations and different levels of complexity in a risk-free environment. This study presents how an iterative game development methodology has been applied to evolve from a paper-based case teaching method to a game-like simulation, with a special focus on the efforts made to include the ONT experts’ tacit procedural knowledge in the simulation. Apart from increasing the number of students who can access the ONT training, this game-like simulation also helped to achieve a more detailed formalization of transplant management as well as a more comprehensive systematization of a set of relevant teaching cases.","258169","Open Access","0.7007","0.1623","6","Inteligencia artificial","Inteligencia artificial","0",NA,NA,"",""
"10.1016/j.cad.2013.10.007","base_oa_____::ee05619eeb13343cb0cd275cd70322e8","Industrial and Manufacturing Engineering","A fuzzy psycho-physiological approach to enable the understanding of an engineer’s affect status during CAD activities","Liu, Y.","2014-09-01","Elsevier BV","publication","","Computer-Aided Design","","","258169","Open Access","-0.6938","0.2645","13","Industrial and manufacturing engineering","Industrial and manufacturing engineering","4","1","68","",""
"10.1016/j.cag.2011.03.013","od______2367::5e68e7815e898180ff29e71328ac69ca","Shape modeling","Geometric Models with Weighted Topology","Attene, Marco","2011-01-01","Elsevier","publication","","","","This paper introduces the concept of weighted topology to model a 3D object whose connectivity and metric depend on a novel notion of weighted arc-length. The weighted arc-length between any two points of the shape takes into account the fact that a part of the object may be either weakly or stronglyconnected to another part. The new model is useful to treat problems which are intrinsically not robust to small topological changes. We describe an example implementation of the model and show how it can be exploited to(1)extend the applicability domain of existing segmentation algorithms and(2) improve the performances of a shape descriptor in a 3D object retrieval scenario.","258169","Restricted","0.2805","0.722","14","Awareness on shared, Supply chain management, Collaborative serious games","Awareness on shared, Supply chain management, Collaborative serious games","0",NA,NA,"",""
"10.1016/j.cag.2011.03.040","dedup_wf_001::56523e13af21bf16e7c54c2b3cc2070e","Semantic 3D media","Semantics & 3D media: current issues and perspectives","Catalano, Chiara","2011-01-01","Elsiever Inc.","publication","","","","3D digital content has become popular as emerging media that can be created, edited and shared by users in a collaborative environment, likewise images and videos. The popularity of 3D media is not confined to the leisure sphere but it increased in many fields ranging from the entertainment market to the industrial product modelling, to health, biology, art, virtual tourism, and more. While problems related to the representation of the geometry of 3D shapes have been largely solved by the CG community, tools for coding, extracting, sharing, and retrieving the semantic content of 3D media are still far from satisfactory: interdisciplinary research efforts are needed to foster the development of the 3D Internet and its applications. The purpose of this paper is thus motivating research in this direction, presenting our vision of the future and, without offering any off-the-shelf solution, giving an overview of the various aspects of semantics required to optimise tasks and processes related to 3D content in different application domains. We identified four grand challenges which synthesise the open issues in common to the considered fields and represent a roadmap towards semantic 3D media.","258169","Restricted","0.6577","0.3559","14","Awareness on shared, Supply chain management, Collaborative serious games","Awareness on shared, Supply chain management, Collaborative serious games","15",NA,NA,"",""
"10.1016/j.clinph.2012.05.020","webcrawl____::c9bd9f5c5c0cdd2548e5b0df6f917a3a","de synchronization;interface relevant;related de","Stability of event-related (de-) synchronization during brain-computer interface-relevant mental tasks","Friedrich, Elisabeth V. C.","2013-01-01","ELSEVIER IRELAND LTD","publication","","CLINICAL NEUROPHYSIOLOGY","","","258169","Closed Access","-0.5956","0.461","3","Brain computer interface, Based brain, Classification performance","Brain computer interface, Based brain, Classification performance","14",NA,NA,"",""
"10.1016/j.clinph.2012.11.010","webcrawl____::4c4577fbf4e6a4ba5d1ed9a4312ea256","based brain;class imagery;evaluation class","Long-term evaluation of a 4-class imagery-based brain-computer interface","Friedrich, Elisabeth V. C.","2013-01-01","ELSEVIER IRELAND LTD","publication","","CLINICAL NEUROPHYSIOLOGY","","","258169","Closed Access","-0.3756","0.6681","3","Brain computer interface, Based brain, Classification performance","Brain computer interface, Based brain, Classification performance","26",NA,NA,"",""
"10.1016/j.compedu.2011.09.017","webcrawl____::e7e795f186317b61128e66a828c5f856","game authoring;educational game;facilitate educational","A narrative metaphor to facilitate educational game authoring","Marchiori, Eugenio J.","2012-01-01","PERGAMON-ELSEVIER SCIENCE LTD","publication","","COMPUTERS & EDUCATION","","","258169","Closed Access","0.1309","-0.6761","4","Educational game, Facilitate educational, Game authoring","Educational game, Facilitate educational, Game authoring","19",NA,"131","",""
"10.1016/j.compedu.2012.03.004","webcrawl____::032a98badfe341855b5319a9b66f37ef","computer games;empirical evidence;evidence computer","A systematic literature review of empirical evidence on computer games and serious games","Connolly, Thomas M.","2012-01-01","PERGAMON-ELSEVIER SCIENCE LTD","publication","","COMPUTERS & EDUCATION","","","258169","Closed Access","-0.1731","-0.5671","7","Commercial outcomes, Comparing scotland, Computer games","Commercial outcomes, Comparing scotland, Computer games","546","46","120","",""
