"doi","id","subject","title","authors","year","publisher","resulttype","language","journal","url","paper_abstract","project_id","accessright","x","y","area_uri","cluster_labels","area","citation_count","cited_by_tweeters_count","readers.mendeley","readers","file_hash"
"10.1504/ijtel.2014.060022","core_ac_uk__::2243e71ad30953b01b0d6a157178f0e1","neuroscientific methods","Neurophysiological methods for monitoring brain activity in serious games and virtual environments: a review","Ninaus, Manuel","2014-01-01","","publication","","","http://radar.gsa.ac.uk/3823/1/BJET_Arnab_2014.pdf","The use of serious games and virtual environments for learning is increasing worldwide. These technologies have the potential to collect live data from users through game-play and can be combined with neuroscientific methods such as EEG, fNIRS and fMRI. The several learning processes triggered by serious games are associated with specific patterns of activation that\ud distributed in time and space over different neural networks. This paper explores the opportunities offered and challenges posed by neuroscientific methods when capturing user feedback and using the data to create greater user adaptivity in-game. Existing neuroscientific studies examining cortical correlates of game-based learning do not form a common or homogenous field. In contrast, they often have disparate research questions and are represented through a broad range of study designs and\ud game genres. In this article, the range of studies and applications of neuroscientific methods in gamebased learning are reviewed.","258169","Open Access","-0.1526","0.0516","9","Cognitive control, Game mechanics","Cognitive control, Game mechanics","9","2","16","",""
"10.17083/ijsg.v2i1.38","dedup_wf_001::611b97bacef995546c1d5b8a8e11f7e3","LB2395.7","Learning through analytics architecture to scaffold learning experience through technology-based methods","Baalsrud-Hauge, Jannicke M","2015-01-01","IJSG","publication","","International Journal of Serious Games","http://nectar.northampton.ac.uk/7346/1/Baalsrud-Hauge20157346.pdf","<p><em><em>The challenge of delivering personalized learning experiences is often increased by the size of classrooms and online learning communities. Serious Games (SGs) are increasingly recognized for their potential to improve education. However, the issues related to their development and their level of effectiveness can be seriously affected when brought too rapidly into growing online learning communities. Deeper insights into how the students are playing is needed to deliver a comprehensive and intelligent learning framework that facilitates better understanding of learners' knowledge, effective assessment of their progress and continuous evaluation and optimization of the environments in which they learn. This paper discusses current SOTA and aims to explore the potential in the use of games and learning analytics towards scaffolding and supporting teaching and learning experience. The conceptual model (ecosystem and architecture) discussed in this paper aims to highlight the key considerations that may advance the current state of learning analytics, adaptive learning and SGs, by leveraging SGs as an suitable medium for gathering data and performing adaptations.</em></em></p>","258169","Open Access","0.2435","0.1147","9","Cognitive control, Game mechanics","Cognitive control, Game mechanics","7","1","29","",""
"10.18278/il.2.1.5","od______2367::57ea6076e56b10671eae92b5f2adde4a","serious games, curriculum integration, pedagogy, psychology","ASPECTS OF SERIOUS GAMES CURRICULUM INTEGRATION - A TWO-FOLDED APPROACH","Popescu, Maria","2012-01-01","Bucharest : Universitatea Nationala de Aparare \"Carol I\"","publication","","","","Over the years, there have been numerous definitions of curriculum integration,where the curriculum is interwoven, connected, thematic, interdisciplinary multidisciplinary, correlated, linked and holistic.[1] Curriculum integration is based on both philosophy and practicality, drawing together knowledge, skills, attitudes and values from within or across subject areas to develop a more powerful understanding of key information. Curriculum integration is best done when components of the curriculum are connected and related in meaningful ways by both students and teachers. With the large uptake of SGs in education nowadays, one must consider SGs curriculum integration an issue at large since effectiveness of SGs use in training and education is getting more and more proponents. This paper looks at SGs curriculum integration issues from two perspectives- of the teacher connecting the content of the game and the learning outcomes into the whole educational context on the one hand, and of the researcher who sees the connection between the pedagogical state-of-art in SG and what realia can offer, on the other. By drawing on the experience of three teams of researchers and educators from Romania, Italy and Spain, based on common activities conducted by same partners and others in the Games and Learning Alliance (GaLA), an EC-funded Network of Excellence on SGs, joint perspectives over curriculum integration will be presented, with a view to sharing the experience in order to give guidelines for future extension of SGs into education and training, into well built curricula. The situations presented of SGs curriculum integration in the three different educational contexts are to showcase the framework for building a SGs curriculum design , the way SGs are effective for instruction, to present forms of integrating a SG into curriculum- how,where, how long, and showcase trans- and inter-disciplinarity within SG curriculum integration. A set of guidelines will be just a quick overview on what both practitioners, researchers and policy makers should consider for the near future in terms of SG curriculum integration, to enhance a lage-scale uptake of SGs into all levels of education and training, to better respond the 21st Century student and current social needs. All the statements and observations will be outspoken based on genuine results of the experiments and longterm practice of the authors in the realm of SGs integration into the training programs.","258169","Open Access","0.6535","-0.1604","11","Games curriculum integration, Deploying serious games, Education lessons learned","Games curriculum integration, Deploying serious games, Education lessons learned","0",NA,NA,"",""
"10.2298/csis121209013t","dedup_wf_001::8f10de84f0ccde0149e369df29458cd2","ComputingMilieux_PERSONALCOMPUTING","Towards a Low Cost Adaptation of Educational Games for People with Disabilities","Torrente, Javier","2014-01-01","COMSIS CONSORTIUM","publication","","COMPUTER SCIENCE AND INFORMATION SYSTEMS","http://eprints.ucm.es/35038/1/ComSIS_atel2.pdf","In this paper we analyze how to increase the level of accessibility in videogames by adding support for it in game authoring software. This approach can reduce the effort required to make a game accessible for people with disabilities, resulting in significant savings. A case study is presented to support the approach based on the eAdventure educational game authoring platform, which allows semi-automatic adaptation of the games. The game, \"My First Day At Work\", was made accessible for students with different disability profiles, mainly blindness, low vision and limited mobility, although hearing and cognitive disabilities are also considered. Results show that the effort needed to make the games accessible is moderate in comparison to the total effort dedicated to game development. Although the specific solutions proposed are optimized for educational games, they could be generalized to other game frameworks and purposes (e.g. entertainment, advertising, etc.).","258169","Open Access","0.1836","-0.4271","7","Commercial outcomes, Comparing scotland, Computer games","Commercial outcomes, Comparing scotland, Computer games","11",NA,NA,"",""
"10.3389/fneng.2014.00021","dedup_wf_001::271c95a5ea35e482671fe359c4bb797a","biofeedback","Brain–computer interface game applications for combined neurofeedback and biofeedback treatment for children on the autism spectrum","Friedrich, Elisabeth V. C.","2014-07-01","Frontiers Media S.A.","publication","","Frontiers in Neuroengineering","","Individuals with autism spectrum disorder (ASD) show deficits in social and communicative skills, including imitation, empathy, and shared attention, as well as restricted interests and repetitive patterns of behaviors. Evidence for and against the idea that dysfunctions in the mirror neuron system are involved in imitation and could be one underlying cause for ASD is discussed in this review. Neurofeedback interventions have reduced symptoms in children with ASD by self-regulation of brain rhythms. However, cortical deficiencies are not the only cause of these symptoms. Peripheral physiological activity, such as the heart rate and its variability, is closely linked to neurophysiological signals and associated with social engagement. Therefore, a combined approach targeting the interplay between brain, body, and behavior could be more effective. Brain-computer interface applications for combined neurofeedback and biofeedback treatment for children with ASD are currently nonexistent. To facilitate their use, we have designed an innovative game that includes social interactions and provides neural- and body-based feedback that corresponds directly to the underlying significance of the trained signals as well as to the behavior that is reinforced. © 2014 Friedrich, Suttie, Sivanathan, Lim, Louchart and Pineda.","258169","Open Access","-0.191","0.4544","12","6132 visual arts and design, Applications for combined, Autism spectrum","6132 visual arts and design, Applications for combined, Autism spectrum","15","1","152","",""
"10.3389/fnhum.2012.00298","dedup_wf_001::997cdb0eb0640bf2eb79bea53d5f6472","6132 Visual arts and design","Enactive cinema paves way for understanding complex real-time social interaction in neuroimaging experiments","Tikka, Pia","2012-01-01","Frontiers Media S.A.","publication","","","","We outline general theoretical and practical implications of what we promote as enactive cinema for the neuroscientific study of online socio-emotional interaction. In a real-time functional magnetic resonance imaging (rt-fMRI) setting, participants are immersed in cinematic experiences that simulate social situations. While viewing, their physiological reactions—including brain responses—are tracked, representing implicit and unconscious experiences of the on-going social situations. These reactions, in turn, are analyzed in real-time and fed back to modify the cinematic sequences they are viewing while being scanned. Due to the engaging cinematic content, the proposed setting focuses on living-by in terms of shared psycho-physiological epiphenomena of experience rather than active coping in terms of goal-oriented motor actions. It constitutes a means to parametrically modify stimuli that depict social situations and their broader environmental contexts. As an alternative to studying the variation of brain responses as a function of a priori fixed stimuli, this method can be applied to survey the range of stimuli that evoke similar responses across participants at particular brain regions of interest.
			Peer reviewed","258169","Open Access","0.1209","0.6728","12","6132 visual arts and design, Applications for combined, Autism spectrum","6132 visual arts and design, Applications for combined, Autism spectrum","7","4","69","",""
"10.4108/sg.1.3.e4","dedup_wf_001::3cc33aca6ebb3196109d6bd65ee544d3","Special aspects of education","Deploying serious games for management in higher education : lessons learned and good practices","Baalsrud Hauge, J","2014-01-01","The Institute for Computer Sciences, Social Informatics and Telecommunications Engineering","publication","","EAI Endorsed Transactions on Serious Games","https://pure.tue.nl/ws/files/3985590/448601050601735.pdf","Deployment of serious games (SGs) and their insertion in higher education (HE) curricula is still low. The lacks papers describing deployment of SGs in HE critically showing educational benefits and providing guidelines and good practices for their use. With the present work, we intend to make a first step in this direction, by reporting our experience in using state of the art managerial SGs in MSc engineering/business courses in four different European universities. In order to describe and analyse the educational characteristics and effectiveness of each game, we propose to use two models that we have straightforwardly extracted from two major pedagogical paradigms: the Bloom’s revised cognitive learning goals taxonomy and the Kolb’s experiential learning cycle. Based on our experience, we also propose a set of lessons and good practices to incentivize and better support deployment of SGs in HE courses.","258169","Open Access","0.528","-0.2764","11","Games curriculum integration, Deploying serious games, Education lessons learned","Games curriculum integration, Deploying serious games, Education lessons learned","4",NA,NA,"",""
